Spill / Vessel,Location,Dates,Min Tonnes,Max Tonnes,Owner
SS Jacob Luckenbach,"United States, Gulf of the Farallons National Marine Sanctuary, San Francisco, California",14 July 1953 – present,"1,484","1,484",
Esso Wheeling,"South Africa, Quoin Point near Cape Town",4 November 1948,,,
Berth 157,"United States, Wilmington",2 June 1948,,,
SS Douglas Victory,"United States, Wilmington, California",27 March 1948,,,
SS River Raisin,United States,1948,,,
Lincoln,"South Africa, Quoin Point near Cape Town",1946,,,
"Greenpoint, Brooklyn","United States, Newtown Creek, Greenpoint, Brooklyn, New York",1940s – 1950s,"55,200","97,400",
Seria Field 14 wells,Brunei,12 June 1945 – September 1945,unknown,unknown,
Scuttled tanker El Grillo,"Iceland, Seyðisfjörður",February 1944 – present,unknown,unknown,
SS Frank H. Buck / SS President Coolidge collision,"United States, San Francisco Bay, California",6 March 1937,"8,870","8,870",
Lakeview Gusher,"United States, Kern County, California",14 March 1910 – 10 September 1911,"1,230,000","1,230,000",
Thomas W. Lawson,"United Kingdom, Isles of Scilly",14 December 1907,"7,400","7,400",
SS Petriana,"Australia, Port Phillip, Victoria",30 November 1903,"1,300","1,300",Asiatic Petroleum Company
